Book Title,Author,Description,Date Modified,Section Title
Mission Impossible,Christopher Nolan,This book is about missions which are impossible to do.,2024-08-12T01:43:14.562380,Miscellaneous
Jungle Book,JK Rowling,This book is about a boy who grows in jungle.,2024-08-12T01:43:14.562380,Adventure
Children of Time,Children of Time Author,This book is Children of Time,2024-08-12T01:43:14.562700,Sci-Fi
Ashes to Action,Ashes to Action Author,This book is Ashes to Action.,2024-08-12T01:43:14.562700,Action
Random Book,Author of Random Book,This is Random Book.,2024-08-12T01:43:14.562700,Adventure
Another Book,Author,This is another book.,2024-08-12T01:43:14.562700,Miscellaneous
